### ISSUE TITLE
run the client is fail 

### ISSUE THREAD

**Issue by guotaosun** [Textalk/websocket-php#76]
Fatal error: Uncaught exception 'WebSocket\ConnectionException' with message 'Empty read; connection dead? Stream state: {"timed_out":false,"blocked":true,"eof":true,"stream_type":"tcp_socket\/ssl","mode":"r+","unread_bytes":0,"seekable":false}'

**Comment by guotaosun** [comment]
this issue happen in following code:
 protected function read($length)
    {
        $data = '';
        while (strlen($data) < $length) {
            $buffer = fread($this->socket, $length - strlen($data));
            if ($buffer === false) {
                $metadata = stream_get_meta_data($this->socket);
                throw new ConnectionException(
                    'Broken frame, read ' . strlen($data) . ' of stated '
                    . $length . ' bytes.  Stream state: '
                    . json_encode($metadata)
                );
            }
            if ($buffer === '') {
                $metadata = stream_get_meta_data($this->socket);
                throw new ConnectionException(
                    'Empty read; connection dead?  Stream state: ' . json_encode($metadata)
                );
            }
            $data .= $buffer;
        }
        return $data;
    }

**Comment by sirn-se** [comment]
The `"eof": true` indicates that the connection has been closed by any part. As I've described in the similar issue #64 this can be circumvented by wrapping the receive() operation within a try/catch clause. The client will attempt to re-connect if called again.

If the issue remain, please provide code snippet that reproduces the issue. I haven't had this exact failure myself, so it's kind of hard to debug without more information.

**Comment by guotaosun** [comment]
I capture the pakages between server  and client as following:


No.     Time           Source                Destination           Protocol Length Info
    335 36.445162      172.17.100.98         172.30.0.68           TCP      74     44486 → 9009 [SYN] Seq=0 Win=14600 Len=0 MSS=1460 SACK_PERM=1 TSval=2564271206 TSecr=0 WS=128

Frame 335: 74 bytes on wire (592 bits), 74 bytes captured (592 bits) on interface 0
Ethernet II, Src: DigitalC_80:3c:03 (00:03:0f:80:3c:03), Dst: Dell_c7:c4:88 (48:4d:7e:c7:c4:88)
Internet Protocol Version 4, Src: 172.17.100.98, Dst: 172.30.0.68
Transmission Control Protocol, Src Port: 44486, Dst Port: 9009, Seq: 0, Len: 0
    Source Port: 44486
    Destination Port: 9009
    [Stream index: 7]
    [TCP Segment Len: 0]
    Sequence number: 0    (relative sequence number)
    [Next sequence number: 0    (relative sequence number)]
    Acknowledgment number: 0
    1010 .... = Header Length: 40 bytes (10)
    Flags: 0x002 (SYN)
    Window size value: 14600
    [Calculated window size: 14600]
    Checksum: 0x634c [unverified]
    [Checksum Status: Unverified]
    Urgent pointer: 0
    Options: (20 bytes), Maximum segment size, SACK permitted, Timestamps, No-Operation (NOP), Window scale
    [Timestamps]
        [Time since first frame in this TCP stream: 0.000000000 seconds]
        [Time since previous frame in this TCP stream: 0.000000000 seconds]

No.     Time           Source                Destination           Protocol Length Info
    336 36.445323      172.30.0.68           172.17.100.98         TCP      66     9009 → 44486 [SYN, ACK] Seq=0 Ack=1 Win=65535 Len=0 MSS=1460 WS=256 SACK_PERM=1

Frame 336: 66 bytes on wire (528 bits), 66 bytes captured (528 bits) on interface 0
Ethernet II, Src: Dell_c7:c4:88 (48:4d:7e:c7:c4:88), Dst: DigitalC_80:3c:03 (00:03:0f:80:3c:03)
Internet Protocol Version 4, Src: 172.30.0.68, Dst: 172.17.100.98
Transmission Control Protocol, Src Port: 9009, Dst Port: 44486, Seq: 0, Ack: 1, Len: 0
    Source Port: 9009
    Destination Port: 44486
    [Stream index: 7]
    [TCP Segment Len: 0]
    Sequence number: 0    (relative sequence number)
    [Next sequence number: 0    (relative sequence number)]
    Acknowledgment number: 1    (relative ack number)
    1000 .... = Header Length: 32 bytes (8)
    Flags: 0x012 (SYN, ACK)
    Window size value: 65535
    [Calculated window size: 65535]
    Checksum: 0xbcfc [unverified]
    [Checksum Status: Unverified]
    Urgent pointer: 0
    Options: (12 bytes), Maximum segment size, No-Operation (NOP), Window scale, No-Operation (NOP), No-Operation (NOP), SACK permitted
    [SEQ/ACK analysis]
    [Timestamps]
        [Time since first frame in this TCP stream: 0.000161000 seconds]
        [Time since previous frame in this TCP stream: 0.000161000 seconds]

No.     Time           Source                Destination           Protocol Length Info
    337 36.446125      172.17.100.98         172.30.0.68           TCP      60     44486 → 9009 [ACK] Seq=1 Ack=1 Win=14720 Len=0

Frame 337: 60 bytes on wire (480 bits), 60 bytes captured (480 bits) on interface 0
Ethernet II, Src: DigitalC_80:3c:03 (00:03:0f:80:3c:03), Dst: Dell_c7:c4:88 (48:4d:7e:c7:c4:88)
Internet Protocol Version 4, Src: 172.17.100.98, Dst: 172.30.0.68
Transmission Control Protocol, Src Port: 44486, Dst Port: 9009, Seq: 1, Ack: 1, Len: 0
    Source Port: 44486
    Destination Port: 9009
    [Stream index: 7]
    [TCP Segment Len: 0]
    Sequence number: 1    (relative sequence number)
    [Next sequence number: 1    (relative sequence number)]
    Acknowledgment number: 1    (relative ack number)
    0101 .... = Header Length: 20 bytes (5)
    Flags: 0x010 (ACK)
    Window size value: 115
    [Calculated window size: 14720]
    [Window size scaling factor: 128]
    Checksum: 0xc477 [unverified]
    [Checksum Status: Unverified]
    Urgent pointer: 0
    [SEQ/ACK analysis]
    [Timestamps]
        [Time since first frame in this TCP stream: 0.000963000 seconds]
        [Time since previous frame in this TCP stream: 0.000802000 seconds]

No.     Time           Source                Destination           Protocol Length Info
    338 36.446127      172.17.100.98         172.30.0.68           HTTP     243    GET / HTTP/1.1 

Frame 338: 243 bytes on wire (1944 bits), 243 bytes captured (1944 bits) on interface 0
Ethernet II, Src: DigitalC_80:3c:03 (00:03:0f:80:3c:03), Dst: Dell_c7:c4:88 (48:4d:7e:c7:c4:88)
Internet Protocol Version 4, Src: 172.17.100.98, Dst: 172.30.0.68
Transmission Control Protocol, Src Port: 44486, Dst Port: 9009, Seq: 1, Ack: 1, Len: 189
    Source Port: 44486
    Destination Port: 9009
    [Stream index: 7]
    [TCP Segment Len: 189]
    Sequence number: 1    (relative sequence number)
    [Next sequence number: 190    (relative sequence number)]
    Acknowledgment number: 1    (relative ack number)
    0101 .... = Header Length: 20 bytes (5)
    Flags: 0x018 (PSH, ACK)
    Window size value: 115
    [Calculated window size: 14720]
    [Window size scaling factor: 128]
    Checksum: 0x51ec [unverified]
    [Checksum Status: Unverified]
    Urgent pointer: 0
    [SEQ/ACK analysis]
    [Timestamps]
        [Time since first frame in this TCP stream: 0.000965000 seconds]
        [Time since previous frame in this TCP stream: 0.000002000 seconds]
    TCP payload (189 bytes)
Hypertext Transfer Protocol
    GET / HTTP/1.1\r\n
    host: 172.30.0.68:9009\r\n
    user-agent: websocket-client-php\r\n
    connection: Upgrade\r\n
    upgrade: websocket\r\n
    sec-websocket-key: TDAkViJbcWxqNDJLUFohOA==\r\n
    sec-websocket-version: 13\r\n
    \r\n
    [Full request URI: http://172.30.0.68:9009/]
    [HTTP request 1/1]
    [Response in frame: 339]

No.     Time           Source                Destination           Protocol Length Info
    339 36.447830      172.30.0.68           172.17.100.98         HTTP     183    HTTP/1.1 101 Switching Protocols 

Frame 339: 183 bytes on wire (1464 bits), 183 bytes captured (1464 bits) on interface 0
Ethernet II, Src: Dell_c7:c4:88 (48:4d:7e:c7:c4:88), Dst: DigitalC_80:3c:03 (00:03:0f:80:3c:03)
Internet Protocol Version 4, Src: 172.30.0.68, Dst: 172.17.100.98
Transmission Control Protocol, Src Port: 9009, Dst Port: 44486, Seq: 1, Ack: 190, Len: 129
    Source Port: 9009
    Destination Port: 44486
    [Stream index: 7]
    [TCP Segment Len: 129]
    Sequence number: 1    (relative sequence number)
    [Next sequence number: 130    (relative sequence number)]
    Acknowledgment number: 190    (relative ack number)
    0101 .... = Header Length: 20 bytes (5)
    Flags: 0x018 (PSH, ACK)
    Window size value: 4106
    [Calculated window size: 1051136]
    [Window size scaling factor: 256]
    Checksum: 0xbd71 [unverified]
    [Checksum Status: Unverified]
    Urgent pointer: 0
    [SEQ/ACK analysis]
    [Timestamps]
        [Time since first frame in this TCP stream: 0.002668000 seconds]
        [Time since previous frame in this TCP stream: 0.001703000 seconds]
    TCP payload (129 bytes)
Hypertext Transfer Protocol
    HTTP/1.1 101 Switching Protocols\r\n
    Upgrade: WebSocket\r\n
    Connection: Upgrade\r\n
    Sec-WebSocket-Accept: htyO73/euXmX6GebqzyVNmVWiAE=\r\n
    \r\n
    [HTTP response 1/1]
    [Time since request: 0.001703000 seconds]
    [Request in frame: 338]

No.     Time           Source                Destination           Protocol Length Info
    340 36.448791      172.17.100.98         172.30.0.68           TCP      60     44486 → 9009 [ACK] Seq=190 Ack=130 Win=15744 Len=0

Frame 340: 60 bytes on wire (480 bits), 60 bytes captured (480 bits) on interface 0
Ethernet II, Src: DigitalC_80:3c:03 (00:03:0f:80:3c:03), Dst: Dell_c7:c4:88 (48:4d:7e:c7:c4:88)
Internet Protocol Version 4, Src: 172.17.100.98, Dst: 172.30.0.68
Transmission Control Protocol, Src Port: 44486, Dst Port: 9009, Seq: 190, Ack: 130, Len: 0
    Source Port: 44486
    Destination Port: 9009
    [Stream index: 7]
    [TCP Segment Len: 0]
    Sequence number: 190    (relative sequence number)
    [Next sequence number: 190    (relative sequence number)]
    Acknowledgment number: 130    (relative ack number)
    0101 .... = Header Length: 20 bytes (5)
    Flags: 0x010 (ACK)
    Window size value: 123
    [Calculated window size: 15744]
    [Window size scaling factor: 128]
    Checksum: 0xc331 [unverified]
    [Checksum Status: Unverified]
    Urgent pointer: 0
    [SEQ/ACK analysis]
    [Timestamps]
        [Time since first frame in this TCP stream: 0.003629000 seconds]
        [Time since previous frame in this TCP stream: 0.000961000 seconds]

No.     Time           Source                Destination           Protocol Length Info
    341 36.448793      172.17.100.98         172.30.0.68           WebSocket 133    WebSocket Text [FIN] [MASKED]

Frame 341: 133 bytes on wire (1064 bits), 133 bytes captured (1064 bits) on interface 0
Ethernet II, Src: DigitalC_80:3c:03 (00:03:0f:80:3c:03), Dst: Dell_c7:c4:88 (48:4d:7e:c7:c4:88)
Internet Protocol Version 4, Src: 172.17.100.98, Dst: 172.30.0.68
Transmission Control Protocol, Src Port: 44486, Dst Port: 9009, Seq: 190, Ack: 130, Len: 79
    Source Port: 44486
    Destination Port: 9009
    [Stream index: 7]
    [TCP Segment Len: 79]
    Sequence number: 190    (relative sequence number)
    [Next sequence number: 269    (relative sequence number)]
    Acknowledgment number: 130    (relative ack number)
    0101 .... = Header Length: 20 bytes (5)
    Flags: 0x018 (PSH, ACK)
    Window size value: 123
    [Calculated window size: 15744]
    [Window size scaling factor: 128]
    Checksum: 0x1e36 [unverified]
    [Checksum Status: Unverified]
    Urgent pointer: 0
    [SEQ/ACK analysis]
    [Timestamps]
        [Time since first frame in this TCP stream: 0.003631000 seconds]
        [Time since previous frame in this TCP stream: 0.000002000 seconds]
    TCP payload (79 bytes)
    [PDU Size: 79]
WebSocket
    1... .... = Fin: True
    .000 .... = Reserved: 0x0
    .... 0001 = Opcode: Text (1)
    1... .... = Mask: True
    .100 1001 = Payload length: 73
    Masking-Key: af7a40fb
    Masked payload
    Payload
Line-based text data (1 lines)
    {"job_id":"sungt1589530815","status":"3","loop_times":"1","runtime":null}

No.     Time           Source                Destination           Protocol Length Info
    342 36.449627      172.30.0.68           172.17.100.98         TCP      54     9009 → 44486 [FIN, ACK] Seq=130 Ack=269 Win=1050880 Len=0

Frame 342: 54 bytes on wire (432 bits), 54 bytes captured (432 bits) on interface 0
Ethernet II, Src: Dell_c7:c4:88 (48:4d:7e:c7:c4:88), Dst: DigitalC_80:3c:03 (00:03:0f:80:3c:03)
Internet Protocol Version 4, Src: 172.30.0.68, Dst: 172.17.100.98
Transmission Control Protocol, Src Port: 9009, Dst Port: 44486, Seq: 130, Ack: 269, Len: 0
    Source Port: 9009
    Destination Port: 44486
    [Stream index: 7]
    [TCP Segment Len: 0]
    Sequence number: 130    (relative sequence number)
    [Next sequence number: 130    (relative sequence number)]
    Acknowledgment number: 269    (relative ack number)
    0101 .... = Header Length: 20 bytes (5)
    Flags: 0x011 (FIN, ACK)
    Window size value: 4105
    [Calculated window size: 1050880]
    [Window size scaling factor: 256]
    Checksum: 0xbcf0 [unverified]
    [Checksum Status: Unverified]
    Urgent pointer: 0
    [SEQ/ACK analysis]
    [Timestamps]
        [Time since first frame in this TCP stream: 0.004465000 seconds]
        [Time since previous frame in this TCP stream: 0.000834000 seconds]

No.     Time           Source                Destination           Protocol Length Info
    343 36.450546      172.17.100.98         172.30.0.68           TCP      60     44486 → 9009 [FIN, ACK] Seq=269 Ack=131 Win=15744 Len=0

Frame 343: 60 bytes on wire (480 bits), 60 bytes captured (480 bits) on interface 0
Ethernet II, Src: DigitalC_80:3c:03 (00:03:0f:80:3c:03), Dst: Dell_c7:c4:88 (48:4d:7e:c7:c4:88)
Internet Protocol Version 4, Src: 172.17.100.98, Dst: 172.30.0.68
Transmission Control Protocol, Src Port: 44486, Dst Port: 9009, Seq: 269, Ack: 131, Len: 0
    Source Port: 44486
    Destination Port: 9009
    [Stream index: 7]
    [TCP Segment Len: 0]
    Sequence number: 269    (relative sequence number)
    [Next sequence number: 269    (relative sequence number)]
    Acknowledgment number: 131    (relative ack number)
    0101 .... = Header Length: 20 bytes (5)
    Flags: 0x011 (FIN, ACK)
    Window size value: 123
    [Calculated window size: 15744]
    [Window size scaling factor: 128]
    Checksum: 0xc2e0 [unverified]
    [Checksum Status: Unverified]
    Urgent pointer: 0
    [SEQ/ACK analysis]
    [Timestamps]
        [Time since first frame in this TCP stream: 0.005384000 seconds]
        [Time since previous frame in this TCP stream: 0.000919000 seconds]

No.     Time           Source                Destination           Protocol Length Info
    344 36.450632      172.30.0.68           172.17.100.98         TCP      54     9009 → 44486 [ACK] Seq=131 Ack=270 Win=1050880 Len=0

Frame 344: 54 bytes on wire (432 bits), 54 bytes captured (432 bits) on interface 0
Ethernet II, Src: Dell_c7:c4:88 (48:4d:7e:c7:c4:88), Dst: DigitalC_80:3c:03 (00:03:0f:80:3c:03)
Internet Protocol Version 4, Src: 172.30.0.68, Dst: 172.17.100.98
Transmission Control Protocol, Src Port: 9009, Dst Port: 44486, Seq: 131, Ack: 270, Len: 0
    Source Port: 9009
    Destination Port: 44486
    [Stream index: 7]
    [TCP Segment Len: 0]
    Sequence number: 131    (relative sequence number)
    [Next sequence number: 131    (relative sequence number)]
    Acknowledgment number: 270    (relative ack number)
    0101 .... = Header Length: 20 bytes (5)
    Flags: 0x010 (ACK)
    Window size value: 4105
    [Calculated window size: 1050880]
    [Window size scaling factor: 256]
    Checksum: 0xbcf0 [unverified]
    [Checksum Status: Unverified]
    Urgent pointer: 0
    [SEQ/ACK analysis]
    [Timestamps]
        [Time since first frame in this TCP stream: 0.005470000 seconds]
        [Time since previous frame in this TCP stream: 0.000086000 seconds]

**Comment by guotaosun** [comment]
Verified in the last version,the issue is still exist!
Fatal error: Uncaught exception 'WebSocket\ConnectionException' with message 'Empty read; connection dead? Stream state: {"timed_out":true,"blocked":true,"eof":false,"stream_type":"tcp_socket\/ssl","mode":"r+","unread_bytes":0,"seekable":false}' 


i fixex the issue add the function in Client.php

public function tlclosed(){
        socket_shutdown($this->socket , 2);
        socket_close($this->socket);
    }

In my application ,i need send the job to testlink ,i use the socket protocol.When user deliver the job to testlink then close the socket protocol.

**Comment by sirn-se** [comment]
As mentioned, your code need to `catch` any error during I/O. This client does *not* silently consume I/O errors, for good and bad.

The `socket_*` functions relies on optional package in PHP compile so we can not use it. If closing the connection is the problem, `$client->close()` *should* handle the shutdown process properly. If not, please provide a code snippet that *reproduces* the issue.

**Comment by guotaosun** [comment]
my client code as following：
public  function sendJobToCloud($jobid){
        $re="Ok";
        $serverip=$jobid['running_vdi'];
        $serverport=$jobid['server_port'];
        $arr = array("job_id" => $jobid['job_id'],"status"=>$jobid['status'],"loop_times"=>$jobid['loop_times'],"runtime"=>$jobid['execute_time_setting']);
        $message=json_encode($arr);
        try {
            $client = new DWebSocket\Client("ws://$serverip:$serverport");
            $client->send($message);
            #$re=$client->receive();
            #$client->close();
        } catch(Exception $e){
            $re= $e->getMessage();
        }finally {
            #$client->close();
            $client->tlclosed();
        }
        return $re;

    }

**Comment by guotaosun** [comment]
thank you very much ! in my application ,the client send jobinfo to server,client need't revice the server respon.
